,Positive (1); Neutral (2) Negative (3),comment,,
"&acute;&acute; and celibacy. it&acute;s like gene&acute;s cause certain people to think in certain ways so babies won&acute;t be made. no it&acute;s not a joke thread and i too have thought that maybe homosexulaity is natures way of controlling the poplulation too..... what percentage of people are gay something like 10%, right? and besides, gay people still have kids. how the hell is a gay gonna have a kid?? the same way straight people have kids. um.....i think you should have a chat with your parents.",3,,,
"&acute;&acute; i understand money is hard to come by because i&acute;m poor as hell right now, but by the time re5 comes out you will be able to buy a 360+re5 for around $250. save .50 cents a day starting tomorrow and you&acute;ll get there. that would make the 360 $190. if re5 comes out in 2012 (which it won&acute;t), i&acute;m sure 360 will be that much. re5 won&acute;t be out until fall 2008/spring 2009, you don&acute;t think the core will be $200 by then?",2,,,
"[quote=&acute;neildneil&acute;] street fighter iv. oh my god this game is definitely down to skill as i lost 36 games online before i finally won one. also codmw2 i don&acute;t think is very skillful as on the few occasions i&acute;ve played online, i&acute;ve done pretty well, even winning once or twice, and i suck at shooters... and i really mean suck. thats not really skill as most sfiv players have their lil unbreakable move sets they use over and over, thats not skill thats just retarded",3,,,
"[quote=&acute;sorax64&acute;][quote=&acute;-eddy-&acute;][quote=&acute;sorax64&acute;] 64 is my second favorite number! :p holy crap! it just hit me...my favorite number, 32, is half of my second favorite number, 64! :o :o how do you feel about 16? how about 128? your age and internet connection? :p idk, they could be :? i&acute;m only 14...:p i love 64 because of the n64, and 32 is my favorite because i&acute;m just a stalker like that and that is the &acute;size&acute; of the girl i love. :p haha, ok i see. :lol:",1,,,
"&acute;&acute; i wouldn&acute;t think that nothing would be proved by going to the center of the earth aside from the fact that it&acute;s hot. is that not the only requirement for hell? or should we expect a welcomed dinner by a few demons? no. but we were starting from the hypothesis that hell was to be found by digging to the center of the earth. seriously, i could never believe hell to exist in the middle of a planet. it cannot be concrete like that.",2,,,
"&acute;&acute; why not cali? :( now i&acute;mma be 3 hours ahead of your ass haha. which island are you gonna be at? well my bro lives out there with his fiancee, about seriously 2 blocks from the beach. he asked me if i wanted to stay with him for awhile and i said why not. he lives on oahu. it&acute;s gonna be awesome. i hate where i live right now, especially since it&acute;s been in the teens lately and there&acute;s nothing but ice and snow.",1,both pos and neg,,
"j dilla-donuts gang starr-daily operation d&acute;angelo-voodoo, brown sugar cap&acute;n jazz-analphabetapolothology jeru the damaja-the sun rises in the east mobb deep=the infamous modest mouse- this is a long drive, the lonesome crowded west nas-illmatic neutral milk hotel-in the aeroplane over the sea biggie-ready to die oh no-dr. no&acute;s oxperiment onyx-bacdafucup organized konfusion-stress: the extinction agenda scarface-mr. scarface is back showbiz & a.g.-goodfellas slum village-fantastic vol 1 smif-n-wessun-dah shinin&acute; stevie wonder-innervisions sublime-sublime atcq-the low end theory ugk-ridin&acute; dirty ultramagnetic mc&acute;s-critical beatdown willie hutch-soul portrait my personal favorites",2,,,
"&acute;&acute; lmao. tht&acute;s funny as hell man. but yet seems a bit cruel to me to embarass her lik tht on live tv. trick deserves it imo.... lawl, that was so mean. paris hilton looked like she was about to cry. sarah silverman is hawt imo :-* ***** know one can ever agree with me on this. people don&acute;t think she&acute;s hawt? smh, ridiculously high standards ftl. only one of my friends think she&acute;s good looking besides me:? i don&acute;t think she&acute;s funny, but iwhi.",1,,,
"as a lakers fan, their play as of late is very concerning. the players around kobe haven&acute;t played well, and overall the lakers are sloppy as hell defensively at this point. but on the bright side, they are still 21-5, and it&acute;s still only december. there is alot of time left to work out their defensive issues, which i think is the main weakness of the lakers. you get that defense fixed up a little bit, you have a team that can challenge the celtics.",2,,,
"the heat are terrible cus they don&acute;t wanna work hard to become a good team. that&acute;s why they don&acute;t want riles to come back, cus he&acute;ll whip their asses into shape. team is a joke and i love it. lebj always has an excuse. first it was he had no teammates even though he won 60 games with them and now he&acute;s on a team with all nba performers and everyone wants to blame the coach. i wish he would just shut the hell up.",3,,,
"&acute;&acute; here we go with the crystal ball predictions again.... anyways, lakers played like crap in that second quarter. once the second unit came in it ****ed up all the good things we had going and we never recovered from it. they&acute;re lucky to be tied. i can&acute;t believe we couldn&acute;t stretch the lead with yao on the bench with 3 fouls. ariza is playing like a scrub and idk why the hell luke walton is in the game at all.6 years, 30 days ago",3,,,
"&acute;&acute; i did break my knuckle cause i hit him in the head multiple times, i just want to know since my knuckle is broken, will people have the impression that i lost? it really only matters what people who were spectating the fight say. you may be the one person who&acute;s telling the fight how it actually happened, but it&acute;s your word against theirs, and numbers in high school always win. that&acute;s the side effect(s) from getting into a fight.7 years, 7 days ago",2,,,
"&acute;&acute; yeah the lead singer of the birthday massacre is said to be a candy goth. they like to wear goth skirts and striped sleeves where it looks like a candy cane. i&acute;ve dated candy goths before. i&acute;m a cyber goth. you said you never had a girlfriend >.> just because you date someone doesn&acute;t really make them your girlfriend. oh you mean it like that, i&acute;m too anti-social to &acute;date&acute; ^_^, just sounds like a waste of time too i don&acute;t go for flings.",2,,,
"[quote=&acute;loonie&acute;][quote=&acute;-karayan-&acute;][quote=&acute;-karayan-&acute;][quote=&acute;rahzel31&acute;] my reasoning is (im gonna get flamed for this) that it isnt natural to be gay its against human nature and the bible. im sorry if i have offended anyone not natural???? http://en.wikipedia.org/wiki/list_of_animals_practicing_homosexual_behavior care to comment at all? wow, homosexual insects. and to the tc, maybe he should go to the gay gamers union and ask this question. mind you, that have actually been documented. so people saw two insects going at it and checked to see if they were of the same sex.",2,,,
"[quote=&acute;fkid&acute;] but then i can flip the other way around and say that the rich are pissed that even though they worked hard to get where they are, the gov&acute;t still supports the the less unfortunate who did not try as hard. then again, it is soooooooooooooo much easier to bash the rich because simply there is more less fortuante than the rich, right? everyone who works their ass off does not automatically get rich you know. you have a very distorted view of capitalism.",3,,,
"&acute;&acute; why is it &acute;wrong&acute;? mostly just dude stuff.lol nah seriously... we cant change the way people are. so we can learn to deal with it or we can let it bother us.. i do wonder why someone just likes the same gender instead of the opposite or maybe both... that part gets me the most it&acute;s just something you&acute;re born with. people don&acute;t suddently decide &acute;lets be gay lets be shunned by society, lets become attractive to those i find icky at this moment.&acute;",1,,,
"live free or die hard is a much better movie. the bourne ultimatum is a good movie and all, but die hard was one the nicest surprises this year. it was one of the few movies this year that i left the theater thinking the movie was better than i thought it was going to be. and whats with all the camera shaking in the bourne ultimatum? i know they went for a realistic feel, but i was dizzy by the end of the movie.",1,,,
"&acute;&acute; i&acute;m not sure what you are asking. i thought it was straightforward. i dont know what gun culture is. i was pretty sure you could explain ah sorry, you said gun control at first. and gun culture itself is pretty straightforward. it is the culture surrounding guns. guns are very cherished instruments in america. there&acute;s a lot of enthusiasm surrounding gun ownership; you can join clubs with fellow gun owners, go to gun shows, ect. that glorification is not something i&acute;m very fond of.",2,,,
"&acute;&acute; so if you were in a car crash and half your guts were over the floor and the paramedics came to help you&acute;d just say &acute;no thanks&acute;? :| i have lightning fast reflexes, so the chances of that even happening are zero to none to begin with, nice try though. yeah but what if you use your &acute;lightning fast&acute; reflexes to dodge a car, but then *bam!* hit by a semi, and now you&acute;re cut in half, intestines spilled out, paramedics surround you......now what?",3,,,
"&acute;&acute; ...so what happens to the children if they don&acute;t &acute;repent&acute;? are they taken away from their parents and placed in a foster home? i&acute;m sure that would make everything better :roll:. how about, instead of exacerbating the issue, we allow divorced parents to raise their children, and we allow gay couples who are willing to be parents to adopt children that are in need of some solidarity in their life, rather than just moving from foster home to foster home.6 years, 28 days ago",3,,,
"&acute;&acute; these kind of threads really piss me off sometimes. i mean, why the hell would you care? you make it sound like you&acute;re &acute;superior&acute; in some way, just because you&acute;ve had sex. oh and fyi, there&acute;s more to relationships than just sex. thought i was the only one on gamespot who had a ******* brain. paparazzi00 is just a stupid immature spammer. you two need to loosen up! you need to open your eyes to the fact that paparazzi00 is 10 years old :|",3,,,
"&acute;&acute; well i&acute;m an agnostic. i personally believe that when you die you go to a unified afterlife, if that makes sense. i don&acute;t believe in a &acute;heaven&acute; or &acute;hell&acute; just a place where everyone goes when they die. there is so much evidence out there to support and afterlife but not enough to say what it is or what its like. what evidence do you speak of? i, personally, don&acute;t worry about what happens after death because there is no way of knowing.",2,,,
"&acute;&acute; what about you? would you brave the elements, or use your wits to save micah? hmmm, if i were living for only myself, i think i may die...but knowing that i&acute;d be doing it for my son can give someone incredible strength and determination. once you&acute;re living for someone or trying to save someone you love, human beings can become unstoppable machines. so, if it were for my son or someone i love, i&acute;d die trying...no matter what torture i was put through.",1,,,
"&acute;&acute; i&acute;ll protect you!!!!!!!! *stands in front of _marisa_ with rusty knife* ^_^ *stands in front of steppin with a spiked d!ldo* :d it&acute;s official. kratos, steppin, and marisa, are the kinkiest oters. :oops:8) let&acute;s not forget our sexified tomxizor :d with our powers combined, we shall conquer the world!!!! they&acute;ll be so sore, they won&acute;t be able to sit down for weeks ^_^ if i were a guy, i&acute;d be gay just so i could sex you up :d8 years, 18 days ago",2,,,
"&acute;&acute; well if hamas and islamic/political extremists backed down and topped firing rockets at israel... hamas keeps saying &acute;we&acute;re fighting back because israel attacked us&acute; but they&acute;re fogetting that they fired first. they, the hamas, are attacking for a reason, they lost 90% of their land and that&acute;s being &acute;active&acute;. that&acute;s why they &acute;shoot rockets&acute;. as an analogy, if you stole money from me but i reacted by hitting you, it would not give you the right to hit me and steal me again.",2,,,
"i don&acute;t pay them any attention. they&acute;re being paid to be there. they don&acute;t care about anything that happens there. smile, look pretty for the camera. i had one at a convention i went to try to sell me a calender or something with pictures of her in it. like, she wanted me to pay money to have a calender with pictures of her in it. fuck that, porn is free on the tubes. and if i want women to pretend to be interes",3,,,
"you know what i hate? i hate how whoever is doing the report, asks the person for a photo but to &acute;give us a pose to show what you went thru and how you felt&acute; (or something along the line ) amd_alexa_gonzalez.jpg picture by scallywag66 the hell did they ask her to pose like that for? that&acute;s a stupid picture in any event, i dont think it was worth arresting here, but you know, sometimes they have to make an example out of somebody.",3,,,
"well just went ahead an ordered a 320 gb hard drive for my xbox 360 should be better now, since i&acute;ll have memory for my xbox 360 i can use got it for $100 would of bought the 250 gb but it was like nearly $90 so another $10 for a 320 wouldn&acute;t hurt and went with that. and looks like i&acute;m at level 42 should of reached the level few days ago though, anyway 8 more to go till i hit level 50.",2,,,
"depends on what you&acute;re playing. if you&acute;re doing high school musical and kirby, then yeah. however, final fantasy iv/iii, contra 4, castlevania:dawn of sorrow/order of ecclesia/portrait of ruin, the phoenix wright games, chrono trigger, ketsui death label and a lot more will statisfy your hardcore needs. fire emblem: shadow dragon is out soon. psp has some good games on it, but not enough compared to the ds. sure, locoroco, mgs:po, ffvii:cc and a couple others are interesting, but not enough to justify a purchase.",2,,,
"&acute;&acute; yeah outside of eustice or whatever his name is i thought was kind of annoying, someone i probably would of hit for talking and complaining too much. but have loved the soundtracks to all the movies as well as the story though. and i think i heard if they do a 4th one it might be the silver chair or the magician&acute;s nephew not sure on that or if they will. just watched that recently as well then watched the dark knight after.",2,,,
"&acute;&acute; wack!!!!!!!!!!!!!!!! the beat is horrible and so are his &acute;rhymes&acute; the earth is a space ship goin round and round? that is wack. compare it to &acute;it was a good day&acute; by ice cube. &acute;plus nobody got killed in south central la/ i gotta say it was a good day&acute; ice cube is way better and has a better beat and flow. and he doesn&acute;t look like a p****. you&acute;re probably gonig to hell now, just so you know.8 years, 11 days ago",3,,,
"&acute;&acute; are you gonna get last remanent for 360? i know you want it dude. i dont see how you could play that along w/ tos2 though... if i have to, i will rob a game stop at gun point for that game.... no, not really :p, but i do want it, badly. if ive managed to juggle all those games im pretty sur i can juggle the last remnant and tos2.... or ill just play tlr and shut out every other game ;).",1,,,
"&acute;&acute; i actually disagree with that notion. if he wants to continue to take risks such as rango, depp will need surefire things to put money in the bank. pirates is that golden ticket. but depp is already crazy rich. his personal net worth is around $200 million. he doesn&acute;t have to work another day in his life if he doesn&acute;t want to. there&acute;s no reason for him to be complicit in the continuation of the pirates franchise. i say let it die already.",3,,,
"im 15 and the problems i have had w/ the parents is that getting xbox live is gonna give the computer viruses( i dont know where they got that. my dad thinks hes smart w/ computer stuff, but he&acute;s not) and the only other thing is that they think that i waste my money and stuff but once i get my job started bac up during the fall im gonna be buyin a wii and a lot of games so i dont really care.",3,,,
"i&acute;ve been in the beta since day one but i&acute;m not sold on cod world at war. it doesn&acute;t feel as polished as cod4, and i have issues with the hit detection and balance of weapons. it just doesn&acute;t click with me like cod4 did. i&acute;ll stick with cod4. i&acute;m also surprised that to me cod4 looks better. not getting cod world at war, will play left 4 dead and gears 2 online until cod6 lands, that will be the true sequel to cod4.",3,,,
"probably an open world game you that you can play as a dragon and fight other dragons and creatures and be able to customize the dragon and select different elements like darkness, light, water, wind, fire earth, electricity and others. maybe add a telekinetic dragon in. and would like a 3d zoids fighting game like battle legends, also want a legend of spyro hd trilogy that and more games you can play as a dinosaur would be nice. and maybe more space exploration/battle games",2,,,
"&acute;&acute; i guess by that logic it doesn&acute;t matter how you feel about him veto&acute;ing it. no because support for the gay marriage is the right thing. but you can keep on using the economy as the reason why you&acute;re against it. we&acute;ll buy it. ^_^ funnily enough, based on a study done by ucla, legalizing gay marriage in new jersey would create 1,400 jobs and generate over 15 million dollars in tax revenue. so there are really no excuses.3 years, 2 days ago",1,,,
"&acute;&acute; yep, noticed it while watching the psn version. did anybody notice how the masked person on meryl&acute;s team wasn&acute;t affected like everyone else? i wonder who the hell that is. olga&acute;s child??? edit/maybe not olga&acute;s child though. how many years after shadow moses did the big shell incident take place? in this newest trailer naomi says to snake &acute;9 years ago at shadow moses, i injected you with foxdie&acute; was olga&acute;s childs age revealed during mgs2? who knows.. my immediate guess was raiden.",2,,,
"lots and lots of weapons, balanced upgrades, a good ranking system, good multiplayer and single player, a real story (meaning a good one that makes alot of sense and loveable characters), good physics, good hit registration, an amazing atmosphere, several multiplayer modes, server browser, real weapon sounds, cool weapon sounds, creativity and detail in level design, decent system requrements!!!!!, simple and easy controls, good ambient sounds, easy to access cheats for single player only, a long single player campaign, a good anti cheat system.",1,,,
"lots and lots of weapons, balanced upgrades, a good ranking system, good multiplayer and single player, a real story (meaning a good one that makes alot of sense and loveable characters), good physics, good hit registration, an amazing atmosphere, several multiplayer modes, server browser, real weapon sounds, cool weapon sounds, creativity and detail in level design, decent system requrements!!!!!, simple and easy controls, good ambient sounds, easy to access cheats for single player only, a long single player campaign, a good anti cheat system.",1,,,
"you can always spot people who don&acute;t follow politics very much. bills like these are introduced all the time. they never get passed in their original form, if they make it through at all. i would be surprised if this proposal didn&acute;t die on the floor. if it makes it through, it&acute;ll be only for extreme cases, such as dangerous animals (like, i dunno people that own a monkey that rips off their friend&acute;s face... stuff like that.) deep breath. it&acute;s gonna be okay.",1,,,
"i just left a dom match because it pissed me off and reminded me i missed a point in the list i made in this topic. terrible spawn points i put a care package down in an area we owned, 4 guys, maybe more spawned right behind me, swarmed on me, killed me and took my package. i respawned, put down a sentry gun (i use hardline pro so i can change it) and what happens? same thing as before. very very frustrating game.",3,,,
"&acute;&acute; no, actually, it doesn&acute;t save money. millions of dollars are wasted on the judicial processes before they&acute;re sentenced to death, and then that&acute;s topped off by the fact that they sit on death row for years in prison before they are actually executed. and honestly, if i had to live in a prison for the rest of my life, i&acute;d much rather die than rot away in there for years before i either get killed by an inmate, or die of old age.",3,,,
"&acute;&acute; yea, true. just no telling how long it will actually be before such a patch comes out. i can understand your frustration though dude. sh*t like that buggs the hell out of me. i figure ill wait till probably monday, if not bestbuy i go. and yeah. like i just want to play lmao. both are such great games when they work. i know right? it&acute;s like f*ck, i&acute;m not trying to take over the world. i just wanna play my goddamn game.",3,,,
"&acute;&acute; did you really just say that a wwi game would have an ak-47? a gun that wasnt actually out untill like 1950? the ak-47 first entered service in 1947 in the soviet union, hence the name. now as to his suggestion of the m-16 would also be folly as it didn&acute;t enter service until the vietnam war. actually the 47 in ak-47 refers to its first accepted prototype year, i may be off with the 1950 but the gun didnt enter service in",2,,,
"has any one else been the victim of this, i was playing a game and saw some one charge up to me (rodey ruining) and i thought &acute;idiot:p&acute; and took out my shot gun and started shooting he got about 5 feet away and i blew up xd i was some what surprised. this happend several times through out the match, just wondering how often other people have come across it (btw please dont tell others how to use it, its cheating really :p)",2,,,
"&acute;&acute; let me explain this to you. you don&acute;;t know what you&acute;re talking about. the same thing we men feel about men on women is the exact same hting you htink about men on men or women on women. you find it unnatural to us and we find it unnatural to you. and by unnatural, i mean it has nothing to do with reproducing... if gays are born that way , why we don&acute;t see gay animals too? it&acute;s a choice by human mind......",3,,,
"&acute;&acute; theeagles victory was meh at most, just shows how overrated mike shanahan and mcnub are. the only creditable wins the eagles have this year was against the colts and falcons. i honestly wanna see vick vs a real defense, lets see him out run the packers d. scoring 28 points in ten minjutes is &acute;meh&acute;? vick already wooped the packers defense ass in week 1. if he started that game the eagles would&acute;ve won. you&acute;re lucky you only seen him for one half.",3,,,
"&acute;&acute; farcry 2 is not for everyone! some might really like it but i sure as hell wasn&acute;t one of them. the first two, three hell maybe even five hours are pretty fun but then it just stays the same over and over.. and the diamond spotting is uggg dont get me started online is nothing to write home about either and the ai aren&acute;t all rocket engineers either so.. my oppinion get killzone or r2 for that matter give farcry a rent maybe.",3,,,
"&acute;&acute; i still don&acute;t see why they can&acute;t be married. they can&acute;t procreate, but even if they weren&acute;t married they couldn&acute;t. you can&acute;t say: &acute;stop being gay and have a baby.&acute; even gays can have babies. not with each other but they can still have an artificial insemination (sp?) so in short, i don&acute;t really see your logic. also take into consideration that heterosexual males who have had a vasectomy cannot breed as well. should they be denied their right for marriage as well?",3,,,
"&acute;&acute; you probably don&acute;t give a crap because you cant afford them. :lol: i don&acute;t find being poor and broke as a mutha****** funny. oh, but you&acute;re probably already used to feelin like that. i&acute;m not interested in shoes, so i&acute;m broke? you have a twisted sense of reality. tbh i can&acute;t think of anything more boring than shoes. how the hell are shoes boring? you don&acute;t like lookin good? sorry, i don&acute;t look at people&acute;s or my own feet, i have self confidence.",3,,,
"its a pay-and-go phone, not much to see. dunno the product name, and don&acute;t feel like looking for a picture, its my first phone (i&acute;m 15, was 14 when i got it), have had it since april. two people use cingular -- me, and my brother who goes to school in newark. everyone else in my family pretty much uses verizon. my mother plans on getting new phone soon, and she might add me to the current plan. i sure as hell hope so.",2,,,
