,Positive (1); Neutral (2) Negative (3),comment,,
"awesome move. as sad as i will be to see ariza go(this season he turned into one of my favorite players, and i was planning on buying his jersey if the lakers re-signed him). this move has me excited as hell about next season. two all nba defenders on the same squad and a a great defensive power forward in gasol and another good defensive player in bynum. the lakers are going to be something else on the defensive end.",1,,,
"[quote=&acute;chutebox&acute;][quote=&acute;-halftime-&acute;]jets are the best team. followed by the steelers and ravens. lol @ people saying the pats. no defense, no run game, one dimensional as hell team. they&acute;re not going anywhere. but they just beat the ravens and slaughtered a good miami team. i wouldn&acute;t count them out. their offense will get it done but i&acute;m not gonna trust their defense to do anything. the jets look like the superior team in just about all aspects except for head coach.",2,,,
"&acute;&acute; i&acute;m humble. but when someone talks trash i&acute;m quick to talk back. that&acute;s just the way it is. who got you to say that the lakers were going to beat the suns like they stole something? i also will talk **** when pressed. i was confident, so what? so far i&acute;m right. the lakers are beating that ass. when my team beats ass i&acute;m gonna talk trash. being all friendly with eachother is no fun.5 years, 25 days ago",2,,,
"ok so a couple weeks ago i downloaded limewire... everythign was going fine until today when i noticed a sub menu on the sidepanel of my itunes...it is named administrator&acute;s limewire , under the shared category, so i looked inside and see the titles of the content and i see pornographic names...since i have no freaking clue where the hell it came from i quickly uninstalled limewire and reinstalled itunes...unfortunately it is still there, and i cannot delete it....any help?",2,,,
"after reading through a good 40-or-so pages of these religious dribble about morality and hell, i think i&acute;d be a lot happier in hell than i would be in heaven. i&acute;d rather spend eternity with the highly-intelligent minds of aristotle, charles darwin, albert einstein, galileo or gandhi than spend eternity under the dictatorship of a god who justifies eternal damnation to babies, scientists, homosexuals, etc while hanging out with such awesome people like adolf hitler hernn corts, and mary i.",1,,,
"[quote=&acute;pianist&acute;][quote=&acute;-karayan-&acute;]i know you said no deaths but... the death of classic music and opera, baroque etc. it&acute;s not dead... it&acute;s just not recognized to the degree it should be, thanks to the dominance of amateur music making in the western world. well, alright, but it took a hell of a beating. and of course there are still people like david lanz who keep making new things. not that it&acute;s possible to ever run out of stuff to listen to. :p",2,,,
"&acute;&acute; actually it is....soros th little socialist trooper he is...decided to leave out the fact that you can not own a firearm that was not registered prior to 1976.....(the law was jsut overturned about 2 weeks ago and they are appealing that)......dc does not at this second have the highest gc law....but they are hoping to put it back in place.... meh ok, anyway, it&acute;s still not a valid arguement as europe shows that strict gun laws don&acute;t increase violence.",2,,,
"&acute;&acute; you have to love the people they have never heard of independent wrestling. :roll: wrestling won&acute;t die out for awhile, with promotions like ring of honor and pwg fronting the independent scene. in terms of global base; wwe will not die out. it&acute;s a multi million dollar corporation and they just need to get wrestlers who are not technically known at first, and build them up. not get the biggest people you can find and well...not build them up.",2,,,
"&acute;&acute; i kinda laughed at how little the fire does. first off, it doesn&acute;t really look all that great (although very few games can make fire look good), and second, it had no effect when guys were going through flaming tables, getting hit with flaming 2x4s, etc...nothing different happened, from what i saw. yeah. no selling of it, or the guy being on fire, or even any mention from the announcers. ... but its on fire. its teh kewlness. but...but...:o",3,,,
"i&acute;m a bit worried with the gpu temps actually. the hypertx2 cooler from cooler master would do a good enough job, hell it can even take some ocing albeit not too extreme. it can reach 34 degrees celsius here at summer&acute;s height. the gtx280 can reach around 85 degrees celsius at it&acute;s worst (and this is from a guy who&acute;s in a 22 degree room). i can just imagine what a 4870x2 would do to the temps, or quadfire :?.",2,,,
"its not a &acute;strategy&acute; if someone uses a cheat to go into a wall, and get an automatic kill. i dont play on wifi, i cant most the time. once pokemon d/p comes out, im gonna try to buy the wifi adapter. but, playing other games online, cheating and glitching is a big problem, which many developers basically go &acute;la la la, i can not hear you, la la la...&acute; to when people complain about it, which is a shame.",3,,,
"i&acute;ve finished f.e.a.r.2 and i tried a good few times to slide tackle enemies but it never worked for me. doesn&acute;t matter anyway since the melee in the game is so stupid and badly done. one hit will kill enemies although you never need to melee them anyway since you rarely get close enough to do it before they die from gunfire. the game is just way too easy for a start, and one-hit kill melee attacks are just stupid.",3,,,
"i&acute;ve finished f.e.a.r.2 and i tried a good few times to slide tackle enemies but it never worked for me. doesn&acute;t matter anyway since the melee in the game is so stupid and badly done. one hit will kill enemies although you never need to melee them anyway since you rarely get close enough to do it before they die from gunfire. the game is just way too easy for a start, and one-hit kill melee attacks are just stupid.",3,,,
"&acute;&acute; save system was fine. you just mad. save system was not fine. if you die in a dungeon, you lose almost a fourth of your progress in the entire game. not cool. then don&acute;t die in a dungeon :p :| oh, isn&acute;t that just nice. &acute;this game screws you royally if you die, so don&acute;t die.&acute; :| i&acute;m sorry, but maybe the game shouldn&acute;t be screwing me royally if i die in the first place. it. was. a. joke.",3,,,
"&acute;&acute; yup... i think you got your definitions from a liberal site...im conservative and against any government interference from economy to personal freedoms i.e gun control a traditional conservative government wants to increase state power, because the world is dangerous and the state must be able to protect itself and its people with the most power necessary. it also wants to hold up traditional values and beleifs. free economy is a classical liberal idea which most modern conservatives have adopted.",2,,,
&acute;&acute; news flash... hiroshima and nagasaki were filled with civilians......if they didn&acute;t want to target civilians they&acute;d have hit a military installation. japan did have quite a few of those. so please spare me the justification for hitting a civilian installation. no both cities were militarily important cities. it was a military objective. and hey...it worked for a quick end to a war with less casualties. negotiating a peace agreement with japan would&acute;ve ended the way with even fewer casualties.,3,,,
"i gave you my credit card i made that money cause i work real hard i thought you were stealin&acute; it so i stabbed your face and the cops sprayed me with lots of mace. i got just one month in jail but i didn&acute;t have enough to pay bail but now i&acute;m here as you can see you look reak pissed off at me hey, guess what i slipped in your drink? now your going to suck my ****",3,,,
&acute;&acute; save it? :lol: there&acute;d be people catching ass whoopins left and right if i went back. then let&acute;s go back. i mean for god&acute;s sake their are threads about halo vs zelda. :cry: :? that reminds me of the &acute;gta vs zelda&acute; threads.....*shudders* someone once said that halo had the greatest story ever in a video game and then went on to say mgs&acute;s story was &acute;mediocre&acute; in comparison....:| that is enough for me to spit in his face.,3,,,
"there&acute;s a bit of a pinch when the needle goes in but after that its smooth sailing. you should be aware though that your arm might be a bit sore afterwards, and you might feel a bit light headed. for me i was unfortunate enough that since my immune system took a bit of a hit after losing the blood i quickly caught a rather nasty bug.. so remember to take it easy afterwards and stay away from the sickies.",2,,,
"&acute;&acute; well i dont mind, as long as she isn&acute;t arrogant like i used to be meh just leave her be, i poked that fire alot of times. shes just better off ignored and if you dont agree with what she says just let it go yeah, best thing to do... well coming from her, tbh, you didn&acute;t sound especially comforting whicker. i may never know what really happened, but that was one unnecessary arguement:| thats was just retarded agreed:lol:",2,,,
"ive had the flu before but the worst pain/discomfort i ever felt was when i caught this stomach virus. only had it for basically one day but that day i had it i wanted to kill myself. if i had a shot gun i would have shot myself it was that bad. my whole body was aching, i was throwing up food and my stomach felt like a tornado was turning inside. i couldnt walk and couldnt eat anything.",2,,,
"&acute;&acute; tbh it would do me a lot of good. i mean, i really really enjoy my tobacco but i want to quit so bad. however, it is a slippery slope...if we ban tobacco, why not alcohol? and i would absolutely not be able to survive without alcohol. i would fight,kill, and die (well, maybe notdie...)to ensure that people retain the right to drink refreshing beers and tasty cocktails. none of it should be banned. drug prohibition is pointless.",2,,,
"i know everyone has seen the marvel and dc videos with superman and spider-man but this video is with the green goblin and lex luthor and it is probably more funny than all those other videos. if you have already seen this video, than feel free to curse me straight to hell for not looking at every thread ever made to see if this was previously posted. if you haven&acute;t see this video please enjoy, i know i did.",1,,,
"&acute;&acute; i was kind of yoking. i&acute;m only okay at figuring stuff out. but, once i figure it out (or it&acute;s explained to me) i can kick ass with it. which has irritated friends of mine at times. especially in fighting games. then you better practice for brawl :wink: is practice on melee even going to matter if you use the wiimote for brawl?.....honestly.. apparently you won&acute;t need to use the wiimote in brawl. :!8 years, 1 month ago",2,,,
"&acute;&acute; i dont know where homosexuals are stepping but theists like you step on other people&acute;s rights. once again, this has never been a right. and don&acute;t show me that court article from the 60&acute;s. that was from an interracial marriage debate, and this is completely different. marriage is a right. the issue of gay marriage is a civil rights issue. now, you can say that gays should be deprived of this right, but it is a right nonetheless.",2,,,
"the observer effect should explain how &acute;god&acute; was created, if that can be applied........ i think we all are god. we are all part of the fabric that makes up life, so to me that means that not one person or entity has a higher grasp of things over any other concious living object/being. in truth, the quetion wqill never be answered, or it might once we die and cross over to what some believe is our true selves.",1,,,
"as good an image as that is, i really wish the nation would work together just as hard to get the perpetrators of 9/11 out of our offices worldwide and onto lamp posts hanging by a noose. it shouldn&acute;t really be all that hard to see how the subsequent events that followed thereafter have only been in favor of corporate interests, but i suppose i can understand why people would prefer to believe the lie rather than the truth.",3,,,
"&acute;&acute; what possible entertainment could someone get from being dead? its peaceful. like a few vicodin. plus we wont interact with anythign in the future, it will all be based on virtual reality and we will create our own paradises and live in them only to &acute;come out&acute; of virtual reality and into the &acute;real world&acute; from time to time to maybe scratch an itch or go crap or something. what the hell are you talking about? lol :p",2,,,
"i was guilty of doing that as a teenager if someone would ask for heavy onion or heavy mayo while i was making sandwiches, i would grab a handful of onion or lettuce and place it where the wax wrap could still fold up, or i&acute;d smear 3 layers of mayo on top and bottom bun. i often get my orders screwed up at most fast food joints, so i guess karma might be kicking me in the ass",2,,,
"&acute;&acute; you can waste your time taking anything banjo says seriously, then. i&acute;m not. there are other respectable people on ot that i&acute;d rather waste my time talking to. just because it doesn&acute;t cost me a lot of effort to verify a story doesn&acute;t mean i outright believe any and everything posted by a certain user. seeing though as that&acute;s how your respond to me was, i can accurately say that you do this because of your narrow view.",3,,,
"&acute;&acute; the same way black history is separated from white history, or women&acute;s history is separated from men&acute;s history. the trouble is that gay is not a separate race or gender. it&acute;s a sexual predisposition and behavior. there are gay people across all genders and races. and there are black people across all genders and orientations, and there are females across all orientations and races. i don&acute;t really see what you&acute;re trying to get at.4 years, 1 month ago",2,,,
"&acute;&acute; they will always be radicals. let them die off. survival of the fittest you know, you&acute;re beginning to sound like a very influential political figure from the 30&acute;s and wwii. he preached social darwinism, how only the strong should survive, and how an entire demographic is basically sub-human, how they were a lost cause, and added nothing to society, and because of that they needed to be cleansed so the strong can emerge, thus benefiting all of society.",3,,,
"&acute;&acute; idk why someone who&acute;s on a sports team is automatically a jock... i played varsity soccer, baseball and wrestling back in high school but i never thought of myself as one. i just enjoyed playing sports because they were fun. ^ hit the nail right on the head. people play the sports because they are fun to play. i play basketball because i find it fun to play. this is definitely the main reason6 years, 1 month ago",1,,,
"obviously mr. cheney is exhibiting the signs of advanced dementia and should be institutionalized for everyone&acute;s protection, especially considering the amount of high security intel that he has been exposed to. http://news.yahoo.com/s/ap/20091102/ap_on_go_ca_st_pe/us_cheney_cia_leak http://www.youtube.com/watch?v=f4phpet8hny c&acute;mon now!!! only because they can, do politicians sit their with smart ass smirks on their faces and continue this &acute;i dont recall&acute; facade. so many times have i seen this in interviews with various journalist, but no one quite urks me more than this cat.",3,,,
"&acute;&acute; lol that isnt basic logic, hell its not even logic. of course pc is a seperate platform and can be compared to both 360 and ps3 and robbo, an ms exclusive? really? thats like saying there is an ea exclusive...on every console. pc is not a console... when you say xbox exclusive most people are referring to consoles... because most xbox exclusives are also on pc, while no ps3 exclusives are on pc.... get it? how about ff14?!?",3,,,
"mine would be video games, reading, bike riding. (i would add watching t.v. but the only show i really watch now is fringe and i&acute;m have been losing interest in house. i did watch lie to me and the human target, but fox once again cancels shows.), and i&acute;ve been trying to get into drawing- since some things i would like to draw would be my dreams, horses,wolves and dragons. anyway that&acute;s about some of the stuff i do.",2,,,
&acute;&acute; oh there will be lawsuits and the mythbusters will have to increase their safety protocols. this is the first time something like this has happened. if i was in a house that got hit by a cannon ball i would want the money to fix the damages + extra just becuase you hit my house with a damn canonball. i&acute;d want to be able to shoot a canon ball into their house as a part of the settlement.,3,,,
"think i seen grown ups 2 in theatres, didn&acute;t care for it, and didn&acute;t care much about going to theatres to see it either, up next will probably be percy jackson & the sea of monsters and catching fire also re-watched war of the worlds and the knowing. not sure what else i&acute;ll be watching. kind of thinking of re-watching percy jackson & the olympians the lightning thief at the moment, maybe timeline and how to train your dragon.",2,,,
"both games have there charms. i didn&acute;t stick woth ass creed as i found it repetitive, but my nephew really liked it. i found oblivion pretty good but it also felt like it was lacking something. the story was pretty weak, and the locations felt very similar all the way through. oblivion is the better game, but if you can get the goty edition then i would get that as it adds shivering isles and a few other extras.",2,,,
"&acute;&acute; if we played the demo and didn&acute;t like it, then why the hell would we go out and buy the game? if you liked it great for you but dont be upset because other people didn&acute;t. and as far as votes go... most people played the demo and if they didnt like it then theyve already moved on and forgotten about haze so the 7.8 is coming from the people who are wanting the game to be good.",3,,,
"i'm sorry, i'm not sure which game you mean, but i'll spam a list of all the freeroam games i know, maybe it helps: total overdose the godfather boiling point true crime new york city gun true crime streets of la mafia scarface driver 3 driver parallel lines the getaway mercenaries destroy all humans! saints row crackdown i can't really find a game fitting your description (casino missions), but maybe i was able to help at least a bit.",2,,,
"is it kinda like splinter cell stealth or more like riddick stuff? (by riddick i men; just go do objectives without being seen, kill first ask later, just get the job done stuff.....by splint i mean stealth is the best way to do it, there is interrogation, lot of hand to hand stuff) btw, i saw the taser but is there alot of fun hand to hand? like can you cut throats with a knife or stuff like that?",2,,,
"[quote=&acute;avistann&acute;][quote=&acute;nicknees93&acute;][quote=&acute;avistann&acute;]i have seen most of the bands i want to but here are some i would love to see before i die modern day escape get scared ronnie radke&acute;s new band lovehatehero i set my friends on fire inhale-exhale i&acute;d like to see your avatar change before i die. i will change it once i hit 4000 posts :p i&acute;m fine with his avay, its his sig that bothers me..:| the singer just looks ridiculous.6 years, 2 days ago",2,,,
"[quote=&acute;avistann&acute;][quote=&acute;nicknees93&acute;][quote=&acute;avistann&acute;]i have seen most of the bands i want to but here are some i would love to see before i die modern day escape get scared ronnie radke&acute;s new band lovehatehero i set my friends on fire inhale-exhale i&acute;d like to see your avatar change before i die. i will change it once i hit 4000 posts :p i&acute;m fine with his avay, its his sig that bothers me..:| the singer just looks ridiculous.6 years, 2 days ago",2,,,
"[quote=&acute;avistann&acute;][quote=&acute;nicknees93&acute;][quote=&acute;avistann&acute;]i have seen most of the bands i want to but here are some i would love to see before i die modern day escape get scared ronnie radke&acute;s new band lovehatehero i set my friends on fire inhale-exhale i&acute;d like to see your avatar change before i die. i will change it once i hit 4000 posts :p i&acute;m fine with his avay, its his sig that bothers me..:| the singer just looks ridiculous.6 years, 2 days ago",2,,,
"&acute;&acute; if you are already a criminal, laws against owning a firearm wont mean anything to you. until you get caught, but the will certainly be useful in keeping you off the streets when that does happen. where i live there is a 5 min to any gun related charge. and lets overcrowd prision with more people who didn&acute;t do anything. we can put all the firearms owners right next to the guys who got arrested for smoking weed.",3,,,
&acute;&acute; the pain of wrestler is real. most of them are in bad shape when they retire and most of them die under really young. they die young because of the steroids and drugs. the reason so many wrestlers use steroids is because it&acute;s much easier to make it in the industry if you are a monster. look at the wwe roster now. guys like batista get pushed like crazy even though they have mediocre ring and mic skills.,2,,,
"[quote=&acute;hydrazz&acute;] do you think a female black belt could beat one of the average guys in ufc, i think probably not because they are too strong and muscular. look at a ufc video if you haven&acute;t already. btw there is a video on youtube of a pro kung fu guy losing to a kickboxer and he doesn&acute;t even get a hit in. i know what vid your&acute;e talking about, but that was because he didn&acute;t try to fight back.",2,,,
"well they weren&acute;t necessarily loud. but they liked drama. and they were abusive to one another. he&acute;d choke her punch her, throw her head through glass windows. she would steal from him, lie to him, hit him aswell, and start needless drama wit hthe neighbors. plu they would cheat on eachother then lie about it. and god forbid when her twin sister comes. all hell breaks loose. eventually he kicked her out, and now he has a new gf.",3,,,
"well they weren&acute;t necessarily loud. but they liked drama. and they were abusive to one another. he&acute;d choke her punch her, throw her head through glass windows. she would steal from him, lie to him, hit him aswell, and start needless drama wit hthe neighbors. plu they would cheat on eachother then lie about it. and god forbid when her twin sister comes. all hell breaks loose. eventually he kicked her out, and now he has a new gf.",3,,,
"well they weren&acute;t necessarily loud. but they liked drama. and they were abusive to one another. he&acute;d choke her punch her, throw her head through glass windows. she would steal from him, lie to him, hit him aswell, and start needless drama wit hthe neighbors. plu they would cheat on eachother then lie about it. and god forbid when her twin sister comes. all hell breaks loose. eventually he kicked her out, and now he has a new gf.",3,,,
"well they weren&acute;t necessarily loud. but they liked drama. and they were abusive to one another. he&acute;d choke her punch her, throw her head through glass windows. she would steal from him, lie to him, hit him aswell, and start needless drama wit hthe neighbors. plu they would cheat on eachother then lie about it. and god forbid when her twin sister comes. all hell breaks loose. eventually he kicked her out, and now he has a new gf.",3,,,
"[quote=&acute;empirefrtw&acute;][quote=&acute;-big_red-&acute;][quote=&acute;empirefrtw&acute;] you are a nice guy she gets harassed by her co-workers for a long time then decides to act upon it and you say she should be hit how fing sexist can you get? i know, i know i just feel really bitter right now. discount about 60% of what i just said. yeah i should apologize as well i suppose i was a bit angry as well when i posted that. meh, don&acute;t worry about it ;).",2,,,
"ive been interested in the game ever since i seen it on on the spot awhile back for psp, its deffintyl a very fun and addictin game, youd think its the kind of game you could play for 20 mins and be happy with just that, but youll soon notice its been 2 hours and you still want to play more, my bro got it for 360 and weve both been playin the hell out of it on there",1,,,
"id never be able to choice whats the funniest, as theres been so many great comedies in my eyes, heres examples of why its so hard to choose monty python & the holy grail/airplane!/how high/halfbaked/supertroopers/clerks ii/dogma- always make me laugh no matter how many times i see it jackass/jackass two/waiting/grandmas boy/40 year old virgin/accepted/borat/not another teen movie- all made me die of laughter the first time i saw them, but never really made me laugh much with repeated viewings",1,,,
"&acute;&acute; of course its a lie and so is a 10 year life span, i sure the console coudl give that long of enjoyment to most but not all, plus the next box will be comein probly 4-5 years into the ps3s 10 year plan, in which case they will make a ps4, and i hope they have it bein uder way allready as the last thing we need is another semi rushed console (ps3)8 years, 1 month ago",2,,,
